{
  "schemaVersion": 1,
  "generatedAt": "2026-09-06T00:00:00Z",
  "notes": "Canonical pool registry (#40). Dispositions from docs review 2026-09-06 (#41). protocolVerifiedAt null until controlled probe exists. Fees must not invent 0 for unknown.",
  "entries": [
    {
      "id": "supportxmr",
      "displayName": "SupportXMR",
      "kind": "stratum-pool",
      "status": "docs-verified",
      "miningChain": "monero",
      "payoutAsset": "XMR",
      "algorithms": ["rx/0"],
      "engineRequirements": ["xmrig", "randomx-js"],
      "endpoints": [
        {
          "id": "plain-3333",
          "transport": "stratum-tcp",
          "host": "pool.supportxmr.com",
          "port": 3333,
          "tls": false,
          "region": null,
          "difficultyHint": "vardiff",
          "protocolVerifiedAt": null,
          "notes": "Legacy default port; live handshake pending #41 probe"
        },
        {
          "id": "tls-443",
          "transport": "stratum-tls",
          "host": "pool.supportxmr.com",
          "port": 443,
          "tls": true,
          "region": null,
          "difficultyHint": "vardiff",
          "protocolVerifiedAt": null,
          "notes": "Listed TLS port; confirm cert/policy before elevating to verified"
        }
      ],
      "account": {
        "user": "xmr-address",
        "pass": "worker-or-x",
        "rigId": "optional",
        "notes": "Standard Stratum wallet login"
      },
      "fees": {
        "poolFee": {
          "status": "unknown",
          "percent": null,
          "asOf": null,
          "note": "Do not treat historical 0.6% as current without fresh evidence (#41)"
        },
        "minPayout": {
          "status": "unknown",
          "amount": null,
          "asset": "XMR",
          "asOf": null,
          "note": "Needs official page/API confirmation"
        },
        "payoutScheme": null
      },
      "sources": [
        { "label": "SupportXMR", "url": "https://www.supportxmr.com/" }
      ],
      "lastReviewedAt": "2026-09-06",
      "lastProtocolVerifiedAt": null,
      "noviceDefault": true,
      "disposition": "Keep as Monero preset; fee/minPayout unknown until re-verified; eligible novice default only as docs-verified not protocol-verified.",
      "description": "Popular Monero Stratum pool",
      "legacyNames": ["SupportXMR"]
    },
    {
      "id": "hashvault",
      "displayName": "HashVault",
      "kind": "stratum-pool",
      "status": "docs-verified",
      "miningChain": "monero",
      "payoutAsset": "XMR",
      "algorithms": ["rx/0"],
      "engineRequirements": ["xmrig", "randomx-js"],
      "endpoints": [
        {
          "id": "plain-3333",
          "transport": "stratum-tcp",
          "host": "pool.hashvault.pro",
          "port": 3333,
          "tls": false,
          "region": null,
          "difficultyHint": "vardiff",
          "protocolVerifiedAt": null,
          "notes": ""
        },
        {
          "id": "tls-443",
          "transport": "stratum-tls",
          "host": "pool.hashvault.pro",
          "port": 443,
          "tls": true,
          "region": null,
          "difficultyHint": "vardiff",
          "protocolVerifiedAt": null,
          "notes": ""
        }
      ],
      "account": {
        "user": "xmr-address",
        "pass": "worker-or-x",
        "rigId": "optional",
        "notes": ""
      },
      "fees": {
        "poolFee": {
          "status": "unknown",
          "percent": null,
          "asOf": null,
          "note": "Historical 0.9% not treated as current (#41)"
        },
        "minPayout": {
          "status": "unknown",
          "amount": null,
          "asset": "XMR",
          "asOf": null,
          "note": ""
        },
        "payoutScheme": null
      },
      "sources": [
        { "label": "HashVault getting started", "url": "https://hashvault.pro/monero/en/getting-started" }
      ],
      "lastReviewedAt": "2026-09-06",
      "lastProtocolVerifiedAt": null,
      "noviceDefault": false,
      "disposition": "Keep Monero preset; re-verify region/TLS/fee before elevating status.",
      "description": "Monero pool (docs entry located; protocol probe pending)",
      "legacyNames": ["HashVault"]
    },
    {
      "id": "moneroocean",
      "displayName": "MoneroOcean",
      "kind": "stratum-pool",
      "status": "docs-verified",
      "miningChain": "monero",
      "payoutAsset": "XMR",
      "algorithms": ["rx/0"],
      "engineRequirements": ["xmrig", "randomx-js"],
      "endpoints": [
        {
          "id": "plain-10128",
          "transport": "stratum-tcp",
          "host": "gulf.moneroocean.stream",
          "port": 10128,
          "tls": false,
          "region": null,
          "difficultyHint": "algo-switching",
          "protocolVerifiedAt": null,
          "notes": "Primary non-TLS port from old UI docs"
        },
        {
          "id": "tls-20128",
          "transport": "stratum-tls",
          "host": "gulf.moneroocean.stream",
          "port": 20128,
          "tls": true,
          "region": null,
          "difficultyHint": "algo-switching",
          "protocolVerifiedAt": null,
          "notes": "SSL port from old UI docs"
        },
        {
          "id": "plain-10001-legacy-ios",
          "transport": "stratum-tcp",
          "host": "gulf.moneroocean.stream",
          "port": 10001,
          "tls": false,
          "region": null,
          "difficultyHint": "low-hashrate-candidate",
          "protocolVerifiedAt": null,
          "notes": "Former iOS preset; not novice default until policy re-confirmed (#41)"
        }
      ],
      "account": {
        "user": "xmr-address-only",
        "pass": "worker-or-x",
        "rigId": "optional",
        "notes": "Pays XMR only — never use WOW/DERO address (#29)"
      },
      "fees": {
        "poolFee": {
          "status": "unknown",
          "percent": null,
          "asOf": null,
          "note": "Do not encode historical 0% as verified known"
        },
        "minPayout": {
          "status": "unknown",
          "amount": null,
          "asset": "XMR",
          "asOf": null,
          "note": ""
        },
        "payoutScheme": "algo-switch → XMR"
      },
      "sources": [
        { "label": "MoneroOcean", "url": "https://moneroocean.stream/" },
        { "label": "MoneroOcean old UI", "url": "https://old.moneroocean.stream/" }
      ],
      "lastReviewedAt": "2026-09-06",
      "lastProtocolVerifiedAt": null,
      "noviceDefault": true,
      "disposition": "XMR payout only; ports 10128/20128 preferred adapters; 10001 retained as non-default endpoint metadata.",
      "description": "Algo-switching pool with XMR payout",
      "legacyNames": ["MoneroOcean", "MoneroOcean (Recommended, XMR payout)", "MoneroOcean (XMR payout)"]
    },
    {
      "id": "c3pool",
      "displayName": "C3Pool",
      "kind": "stratum-pool",
      "status": "unverified",
      "miningChain": "monero",
      "payoutAsset": "XMR",
      "algorithms": ["rx/0"],
      "engineRequirements": ["xmrig"],
      "endpoints": [
        {
          "id": "plain-13333",
          "transport": "stratum-tcp",
          "host": "xmr.c3pool.com",
          "port": 13333,
          "tls": false,
          "region": null,
          "difficultyHint": null,
          "protocolVerifiedAt": null,
          "notes": ""
        },
        {
          "id": "alt-23333",
          "transport": "stratum-tcp",
          "host": "xmr.c3pool.com",
          "port": 23333,
          "tls": false,
          "region": null,
          "difficultyHint": "high-hashrate-candidate",
          "protocolVerifiedAt": null,
          "notes": "Setup scripts mention 23333 as high-hashrate candidate — NOT assumed TLS (#41)"
        }
      ],
      "account": {
        "user": "xmr-address",
        "pass": "worker-or-x",
        "rigId": "optional",
        "notes": ""
      },
      "fees": {
        "poolFee": {
          "status": "unknown",
          "percent": null,
          "asOf": null,
          "note": "Historical 0.9% not current evidence"
        },
        "minPayout": {
          "status": "unknown",
          "amount": null,
          "asset": "XMR",
          "asOf": null,
          "note": ""
        },
        "payoutScheme": null
      },
      "sources": [
        { "label": "C3Pool", "url": "https://c3pool.com/" },
        { "label": "C3Pool xmrig setup script", "url": "https://github.com/C3Pool/xmrig_setup/blob/master/setup_c3pool_miner.sh" }
      ],
      "lastReviewedAt": "2026-09-06",
      "lastProtocolVerifiedAt": null,
      "noviceDefault": false,
      "disposition": "Keep listed but unverified; remove false TLS assumption on 23333; not a novice default.",
      "description": "Monero pool — TLS/difficulty need handshake confirmation",
      "legacyNames": ["C3Pool"]
    },
    {
      "id": "2miners-xmr",
      "displayName": "2Miners XMR",
      "kind": "stratum-pool",
      "status": "unverified",
      "miningChain": "monero",
      "payoutAsset": "XMR",
      "algorithms": ["rx/0"],
      "engineRequirements": ["xmrig"],
      "endpoints": [
        {
          "id": "plain-2222",
          "transport": "stratum-tcp",
          "host": "xmr.2miners.com",
          "port": 2222,
          "tls": false,
          "region": null,
          "difficultyHint": null,
          "protocolVerifiedAt": null,
          "notes": "Help page not readable in 2026-09-06 review; do not claim closed or verified"
        }
      ],
      "account": {
        "user": "xmr-address",
        "pass": "worker-or-x",
        "rigId": "optional",
        "notes": ""
      },
      "fees": {
        "poolFee": {
          "status": "unknown",
          "percent": null,
          "asOf": null,
          "note": ""
        },
        "minPayout": {
          "status": "unknown",
          "amount": null,
          "asset": "XMR",
          "asOf": null,
          "note": ""